{
  "schemaVersion": "1",
  "actionId": "act_01J5ABCDEFGHJKMNPQRSTVWXY1",
  "requestId": "req_01J5ABCDEFGHJKMNPQRSTVWXY1",
  "correlationId": "corr_01J5ABCDEFGHJKMNPQRSTVWXY1",
  "idempotencyKey": "authz_01J5ABCDEFGHJKMNPQRSTVWXY1",
  "adapter": {
    "id": "claude-code",
    "version": "0.2.0-alpha.1",
    "hostVersion": "2.1.219"
  },
  "task": {
    "taskId": "task_01J5ABCDEFGHJKMNPQRSTVWXY1",
    "sessionId": "session_01J5ABCDEFGHJKMNPQRSTVWXY1"
  },
  "action": "mcp:call",
  "target": {
    "kind": "mcp-tool",
    "service": "github",
    "resource": "mcp:github/issues.create#sha256:d7a5ab6559d5c4c9c8214b30cb0197d0a21dd025bc0d51e6d9886c8ac1b5e4af",
    "resourceHash": "sha256:b74df4fefcd5886bc9a8c79ec31b6b74df2080f2bca5ba84d84653612a283d1a"
  },
  "sideEffect": "external",
  "occurredAt": "2026-07-25T20:01:00Z",
  "context": {
    "cwd": "/workspace",
    "repository": "example/service",
    "toolName": "github.create_issue"
  }
}
